{
  "audited": {
    "status": "passed",
    "reason": "Immutable official source and the IMA-consumed interface surface were audited on 2026-09-05."
  },
  "registry": {
    "status": "passed",
    "reason": "Every exact directly relevant package was confirmed in the npm registry on 2026-09-05."
  },
  "packageVerification": {
    "status": "passed",
    "reason": "The same unmodified 0.2.4 release-candidate tarball installed with exact tag packages; Client protocols, Host contract, source boot graph, and delayed credentials readiness passed on 2026-09-09.",
    "evidence": "sha256:2b82e88f02db9dd9f12ab9ff43ce86a38a96617d411a027d42897947c1d86d4e"
  },
  "liveSmoke": {
    "status": "not-run",
    "reason": "No credential-bearing live Web profile was used during this apply run."
  }
}
